{
  "$schema": "https://json-schema.org/draft/2020-12/schema",
  "$id": "https://fior.in/content/projects.schema.json",
  "title": "Fior.in projects and studio games",
  "description": "Schema shared by projects.json and games.json. Employment history lives in resume.json.",
  "type": "array",
  "items": {
    "type": "object",
    "required": ["cover", "year", "color", "title", "description", "tags", "href", "icon"],
    "properties": {
      "cover": {"type": "string", "description": "Cover image file name, relative to /img/"},
      "year": {"type": "string"},
      "color": {"type": "string"},
      "title": {"type": "string"},
      "description": {"type": "string"},
      "tags": {"type": "array", "items": {"type": "string"}},
      "href": {"type": "string", "format": "uri-reference"},
      "icon": {"enum": ["external", "link", "search"]},
      "external": {"type": "boolean"}
    },
    "additionalProperties": false
  }
}
