[
  {
    "cover": "cover-hash.webp",
    "year": "2026",
    "color": "colorYellow",
    "title": "Project #",
    "description": "An original tabletop game for 2–6 players, currently in development. Details remain under wraps.",
    "tags": [
      "Board Game",
      "Game Design",
      "Tabletop"
    ],
    "href": "#",
    "icon": "external",
    "external": true
  },
  {
    "cover": "cover-simulator.webp",
    "year": "2026",
    "color": "colorRed",
    "title": "Project # Simulator",
    "description": "A simulation engine for automated gameplay testing, rule validation, and balance analysis of an unreleased board game.",
    "tags": [
      "Node.js",
      "Simulation",
      "Game Design"
    ],
    "href": "#",
    "icon": "external",
    "external": true
  },
  {
    "cover": "cover-generator.webp",
    "year": "2026",
    "color": "colorCyan",
    "title": "Project # Board Generator",
    "description": "A procedural board generator for creating, configuring, and experimenting with tabletop game layouts.",
    "tags": [
      "Rust",
      "Procedural Generation",
      "Game Tools"
    ],
    "href": "#",
    "icon": "external",
    "external": true
  },
  {
    "cover": "cover-manager.webp",
    "year": "2026",
    "color": "colorCyan",
    "title": "Project # Character Manager",
    "description": "A character management tool for designing, organizing, and balancing playable characters in an original board game.",
    "tags": [
      "TypeScript",
      "Game Tools",
      "Game Design"
    ],
    "href": "#",
    "icon": "external",
    "external": true
  },
  {
    "cover": "cover-lixo.webp",
    "year": "2026",
    "color": "colorGreen",
    "title": "L1XØ!",
    "description": "A playful tabletop game about garbage collection. Drive miniature trucks, collect trash, and deliver it to the depot. Designed for 1–2 players, ages 3+, with quick 10-minute sessions.",
    "tags": [
      "Board Game",
      "Game Design",
      "Family",
      "3+"
    ],
    "href": "#",
    "icon": "external",
    "external": true
  }
]
