[
  {"cover": "cover-studio.webp","year":"2026","color":"colorOrange","title":"Fiorin Games Studio","description":"Independent board game studio creating original tabletop games through experimental mechanics, rapid prototyping, and hands-on production.","tags":["Boardgame","Python", "Rust", "Blender", "AI"],"href":"/games","icon":"link","external":false},
  {"cover": "cover-arcrevil.webp","year":"2026","color":"colorRed","title":"arcRevil","description":"AI-powered architectural PR reviewer that detects design violations, dependency issues, and architectural regressions using static analysis and LLMs.","tags":["AI","LLMs", "RAG","Node.js"],"href":"/games","icon":"link","external":false},
  {"cover": "cover-restyle.webp","year":"2026","color":"colorYellow","title":"Restyle","description":"Image style converter using Google Gemini API and vision models for custom art generation.","tags":["Javascript, GeminiAPI, AI"],"href":"https://github.com/fiorin/restyle","icon":"external","external":true},
  {"cover": "cover-ourstl.webp","year":"2026","color":"colorBlue","title":"OurStl","description":"A STL extractor and mesh downloader for web-based 3D generation tools.","tags":["Node.js"],"href":"https://github.com/fiorin/ourstl","icon":"external","external":true},
  {"cover": "cover-abominapp.webp","year":"2025","color":"colorGreen","title":"Abominapp","description":"Abomination randomizer app for Zombicide tabletop sessions.","tags":["Next.js","HeroUI"],"href":"https://abominapp.vercel.app/","icon":"external","external":true},
  {"cover": "cover-ruins.webp","year":"2023","color":"colorOrange","title":"Ruins","description":"A custom faction mod for Heroes of Might and Magic III. Designed from scratch, encompassing original 3D creature art, custom lore, asset integration, and game balance tuning.","tags":["Javascript", "Photoshop","Game Design"],"href":"http://heroescommunity.com/viewthread.php3?TID=44951","icon":"external","external":true},
  {"cover": "cover-vcmi.webp","year":"2018","color":"colorRed","title":"VCMI","description":"Open-source C++ contribution enabling unique custom hero sprites in battle for the Heroes of Might and Magic III engine rewrite.","tags":["C++"],"href":"https://github.com/fiorin/vcmi","icon":"external","external":true},
  {"cover": "cover-utf.webp","year":"2018","color":"colorYellow","title":"Coding Lab","description":"Open educational materials, including curricula, exercises, and course resources, developed for undergraduate Algorithms and Database courses at UTFPR.","tags":["Python","Java","C","SQL","CSS","HTML"],"href":"https://drive.google.com/drive/folders/12jfbklSXpU0ER53bB6LRWWCUbJnYQIdU?usp=sharing","icon":"external","external":true},
  {"cover": "cover-porteira.webp","year":"2017","color":"colorBlue","title":"p0rte1ra","description":"Desktop livestock management system built with cross-platform web tech.","tags":["Javascript","Electron","Node.js","MongoDB"],"href":"https://github.com/fiorin/p0rte1ra","icon":"external","external":true},
  {"cover": "cover-dont-starve.webp","year":"2016","color":"colorRosa","title":"Don't Starve","description":"A custom playable character for Don't Starve Together, created as an exploration of character design, gameplay mechanics, scripting, and mod development.","tags":["Lua"],"href":"https://steamcommunity.com/id/sarna/myworkshopfiles/?appid=322330","icon":"external","external":true},
  {"cover": "cover-brawl.webp","year":"2016","color":"colorBrown","title":"Brawl","description":"Experimental 2D fighting game built with Phaser, focused on exploring game loop architecture and the underlying systems of real-time gameplay.","tags":["Phaser","Javascript","Photoshop"],"href":"https://github.com/fiorin/brawl","icon":"external","external":true},
  {"cover": "cover-pto.webp","year":"2015","color":"colorCyan","title":"Pto.css","description":"Lightweight utility-first CSS framework built as a Bootstrap alternative.","tags":["Css"],"href":"https://github.com/fiorin/ptocss","icon":"external","external":true},
  {"cover": "cover-bomberman.webp","year":"2011","color":"colorPurple","title":"Bomberman","description":"Bomberman-inspired 2D game built from scratch with vanilla JavaScript, featuring grid-based movement, bombs, explosions, collisions, and real-time gameplay.","tags":["Javascript"],"href":"https://github.com/fiorin/bomberman2010.js","icon":"external","external":true},
  {"cover": "cover-quarto.webp","year":"2009","color":"colorOrange","title":"Quarto Universitário","description":"Custom WordPress theme architecture developed and deployed for university media platforms, with a focus on reusable components, content management, and scalable publishing workflows.","tags":["Html","Css","Php","Javascript"],"href":"/img/quartouniversitario.webp","icon":"search","external":true}
]
